id,document,tag,content
105,0419_Yale,requirement-level,Requiring Students to be Vaccinated Against COVID-19
105,0419_Yale,requirement-who,Requiring Students to be Vaccinated Against COVID-19
89,0419_Yale,expertise,Realization of these plans will depend on favorable public health conditions and the guidance of public health experts.
88,0419_Yale,evidence,"Although the course of the COVID-19 pandemic over the coming months remains uncertain, vaccination is the strongest tool for preventing transmission of the virus. There is abundant evidence of the vaccines’ effectiveness and growing confidence that vaccines will be widely available by early summer."
102,0419_Yale,requirement-level,"Therefore, we are requiring all undergraduate, graduate, and professional school students who plan to be on campus to be fully vaccinated against COVID-19 at the start of the fall 2021 semester."
102,0419_Yale,requirement-who,"Therefore, we are requiring all undergraduate, graduate, and professional school students who plan to be on campus to be fully vaccinated against COVID-19 at the start of the fall 2021 semester."
84,0419_Yale,exemption,We also will make reasonable accommodations for medical and religious exemptions from vaccination.
85,0419_Yale,requirement-level,We are considering whether we also will require faculty and staff to be vaccinated in order to return to campus.
85,0419_Yale,requirement-who,We are considering whether we also will require faculty and staff to be vaccinated in order to return to campus.
90,0419_Yale,expertise,"To inform our deliberations, we have asked a working group, including faculty experts in public health, to make recommendations. We expect to receive the group’s report in the coming weeks and make a determination in June."
86,0419_Yale,community,"From the beginning of the pandemic, we have worked together as a community to develop and follow measures to promote the health and safety of our colleagues, families, and friends."
87,0419_Yale,responsibility of community members,Now we share the opportunity and the responsibility to take the next important step toward putting the pandemic behind us.
91,0428_WashU,safety,"Dear Washington University students, We are planning for the next academic year with an eye toward creating the safest possible environment on our campuses for our students, faculty, staff and visitors."
92,0428_WashU,evidence,The COVID-19 vaccine is becoming more widely available in the United States and its effectiveness in reducing the number and severity of infections is being clearly demonstrated across the country.
94,0428_WashU,community,"Vaccination against COVID-19 will play a key role in allowing us to resume our regular activities, protect our community, and prevent the spread of illness both on our campuses and in the St. Louis region, including, importantly, the patients we serve in our hospitals."
94,0428_WashU,responsibility of community members,"Vaccination against COVID-19 will play a key role in allowing us to resume our regular activities, protect our community, and prevent the spread of illness both on our campuses and in the St. Louis region, including, importantly, the patients we serve in our hospitals."
93,0428_WashU,requirement-level,"For these reasons, all Washington University students on the Danforth and Medical Campuses will be required to receive the COVID-19 vaccine."
93,0428_WashU,requirement-who,"For these reasons, all Washington University students on the Danforth and Medical Campuses will be required to receive the COVID-19 vaccine."
95,0428_WashU,requirement-level,"Students must be fully vaccinated before they arrive on campus for the start of their fall academic term or August 30, whichever comes first."
95,0428_WashU,requirement-who,"Students must be fully vaccinated before they arrive on campus for the start of their fall academic term or August 30, whichever comes first."
100,0428_WashU,exemption,We will allow exemptions for students who are unable to receive the vaccine for religious or medical reasons.
96,0428_WashU,safety,Thank you for your support for our efforts to keep you and our community safe and healthy.
96,0428_WashU,health,Thank you for your support for our efforts to keep you and our community safe and healthy.
97,0511_Purdue,community,"Purdue University, one of the first universities to commit to reopening campus in 2020, has been as open, densely populated, and operational as any school its size while taking measured and necessary steps to protect its campus community. The consistent and nearly universal embrace of the Protect Purdue Pledge by our students, faculty and staff has been vital to the safety of our community during the COVID-19 pandemic."
97,0511_Purdue,responsibility of community members,"Purdue University, one of the first universities to commit to reopening campus in 2020, has been as open, densely populated, and operational as any school its size while taking measured and necessary steps to protect its campus community. The consistent and nearly universal embrace of the Protect Purdue Pledge by our students, faculty and staff has been vital to the safety of our community during the COVID-19 pandemic."
98,0511_Purdue,requirement-level,"Vaccination, according to medical authorities worldwide and evidence on a global basis, is the fastest and surest means today to significantly reduce the risk of exposure and serious il ness, and Purdue continues to encourage al  Boilermakers to get vaccinated now. The greater the percentage of our campus community who are vaccinated, the more protected we al  are and the more we can ease Protect Purdue restrictions and return to ful  normal operations."
98,0511_Purdue,requirement-who,"Vaccination, according to medical authorities worldwide and evidence on a global basis, is the fastest and surest means today to significantly reduce the risk of exposure and serious il ness, and Purdue continues to encourage al  Boilermakers to get vaccinated now. The greater the percentage of our campus community who are vaccinated, the more protected we al  are and the more we can ease Protect Purdue restrictions and return to ful  normal operations."
98,0511_Purdue,responsibility of community members,"Vaccination, according to medical authorities worldwide and evidence on a global basis, is the fastest and surest means today to significantly reduce the risk of exposure and serious il ness, and Purdue continues to encourage al  Boilermakers to get vaccinated now. The greater the percentage of our campus community who are vaccinated, the more protected we al  are and the more we can ease Protect Purdue restrictions and return to ful  normal operations."
98,0511_Purdue,expertise,"Vaccination, according to medical authorities worldwide and evidence on a global basis, is the fastest and surest means today to significantly reduce the risk of exposure and serious il ness, and Purdue continues to encourage al  Boilermakers to get vaccinated now. The greater the percentage of our campus community who are vaccinated, the more protected we al  are and the more we can ease Protect Purdue restrictions and return to ful  normal operations."
98,0511_Purdue,evidence,"Vaccination, according to medical authorities worldwide and evidence on a global basis, is the fastest and surest means today to significantly reduce the risk of exposure and serious il ness, and Purdue continues to encourage al  Boilermakers to get vaccinated now. The greater the percentage of our campus community who are vaccinated, the more protected we al  are and the more we can ease Protect Purdue restrictions and return to ful  normal operations."
246,0511_Purdue,efforts of community members,"And in less than four weeks, Purdue’s on-campus clinic has vaccinated more than 18,000 people against COVID-19."
99,0511_Purdue,community,"Vaccination against COVID-19 also is an expression of the Protect Purdue Pledge: I protect myself from the risk of infection and serious il ness, I protect others by reducing the spread of the virus and possibly more severe variants of COVID-19, and I protect our Purdue community against a large outbreak and the risk of closure."
99,0511_Purdue,responsibility of community members,"Vaccination against COVID-19 also is an expression of the Protect Purdue Pledge: I protect myself from the risk of infection and serious il ness, I protect others by reducing the spread of the virus and possibly more severe variants of COVID-19, and I protect our Purdue community against a large outbreak and the risk of closure."
101,0511_Purdue,exemption,"Employees may choose to decline vaccination against COVID-19 for medical or religious reasons, but those declining wil  be required to participate in frequent mandatory testing on campus."
106,0514_Yale,requirement-level,"Requiring faculty, staff, and trainees to be vaccinated against COVID-19"
106,0514_Yale,requirement-who,"Requiring faculty, staff, and trainees to be vaccinated against COVID-19"
107,0514_Yale,safety,"As we plan for this exciting transition back to campus, our top priority will continue to be the health and safety of students, faculty, staff, and individuals with whom we interact outside of our campus."
107,0514_Yale,health,"As we plan for this exciting transition back to campus, our top priority will continue to be the health and safety of students, faculty, staff, and individuals with whom we interact outside of our campus."
108,0514_Yale,safety,A high percentage of vaccine coverage is critical for a safe return to in-person university operations.
109,0514_Yale,requirement-level,"Therefore, we are requiring all faculty, staff, and postdoctoral and postgraduate trainees to be fully vaccinated against COVID-19 by August 1. This decision follows our announcement in April of the vaccination requirement for all undergraduate, graduate, and professional school students."
109,0514_Yale,requirement-who,"Therefore, we are requiring all faculty, staff, and postdoctoral and postgraduate trainees to be fully vaccinated against COVID-19 by August 1. This decision follows our announcement in April of the vaccination requirement for all undergraduate, graduate, and professional school students."
110,0514_Yale,expertise,"Our decision is based on the recommendation of Yale’s experts in public health, medicine, and nursing, as well as discussions with staff and faculty across campus."
114,0514_Yale,evidence,"There is abundant evidence that vaccines are the strongest tool we have for preventing the spread of COVID-19 and that they are safe. For example, we are already seeing notable reductions in infection rates as levels of vaccination have increased. As a leading global research university, we have a responsibility to demonstrate to others the importance of taking actions based on evidence."
113,0514_Yale,leadership/public services,"As a leading global research university, we have a responsibility to demonstrate to others the importance of taking actions based on evidence."
115,0514_Yale,exemption,"Faculty, staff, and postdoctoral and postgraduate trainees may apply for exemption from the vaccination requirement for medical reasons or based on religious or other strongly held personal belief."
116,0514_Yale,community,"For over 15 months, we have worked tirelessly to protect each other from illness. Yale’s vaccination requirements are an acknowledgement and an extension of these efforts. At this turning point in the pandemic, the administration of each vaccine brings us one step closer to the end of this public health crisis. We are grateful for all you have done for Yale and our community’s health. To those who have yet to be inoculated, please join us in becoming vaccinated against COVID-19 ."
116,0514_Yale,responsibility of community members,"For over 15 months, we have worked tirelessly to protect each other from illness. Yale’s vaccination requirements are an acknowledgement and an extension of these efforts. At this turning point in the pandemic, the administration of each vaccine brings us one step closer to the end of this public health crisis. We are grateful for all you have done for Yale and our community’s health. To those who have yet to be inoculated, please join us in becoming vaccinated against COVID-19 ."
117,0528_Harvard,safety,"Last week Governor Baker announced that he will lift all remaining COVID-19 restrictions in Massachusetts effective May 29. This welcome news reflects an improving public health situation that permits the state to ease restrictions and enable communities to reopen more fully. For the Harvard community, this represents another step forward in safely resuming more on-campus academic and work activities."
117,0528_Harvard,regulations,"Last week Governor Baker announced that he will lift all remaining COVID-19 restrictions in Massachusetts effective May 29. This welcome news reflects an improving public health situation that permits the state to ease restrictions and enable communities to reopen more fully. For the Harvard community, this represents another step forward in safely resuming more on-campus academic and work activities."
119,0528_Harvard,requirement-level,"As previously announced, Harvard will require COVID vaccination for all students who will be on campus this fall. As we work to reach the high levels of vaccination needed to protect our community, we are now extending that vaccination requirement to all Harvard community members, including faculty, staff, and researchers, who will have any on-campus presence."
119,0528_Harvard,requirement-who,"As previously announced, Harvard will require COVID vaccination for all students who will be on campus this fall. As we work to reach the high levels of vaccination needed to protect our community, we are now extending that vaccination requirement to all Harvard community members, including faculty, staff, and researchers, who will have any on-campus presence."
119,0528_Harvard,community,"As previously announced, Harvard will require COVID vaccination for all students who will be on campus this fall. As we work to reach the high levels of vaccination needed to protect our community, we are now extending that vaccination requirement to all Harvard community members, including faculty, staff, and researchers, who will have any on-campus presence."
120,0528_Harvard,exemption,Exceptions will be provided for medical or religious reasons.
121,0528_Harvard,community,The resilience of our community over these past 15 months has been extraordinary. You have adapted to a seemingly endless set of challenges and continued to find ways to fulfill our academic and research mission.
122,0609_Vanderbilt,requirement-level,"As announced last month, COVID-19 vaccinations will be required for all members of the Vanderbilt University community for the 2021–22 academic school year."
122,0609_Vanderbilt,requirement-who,"As announced last month, COVID-19 vaccinations will be required for all members of the Vanderbilt University community for the 2021–22 academic school year."
123,0609_Vanderbilt,requirement-level,"New and returning students are required to be fully vaccinated against COVID-19 for the 2021–22 academic school year. The requirement applies to all undergraduate, graduate and professional students this fall, and it will be handled in a manner consistent with other university policies governing student vaccine requirements."
123,0609_Vanderbilt,requirement-who,"New and returning students are required to be fully vaccinated against COVID-19 for the 2021–22 academic school year. The requirement applies to all undergraduate, graduate and professional students this fall, and it will be handled in a manner consistent with other university policies governing student vaccine requirements."
124,0609_Vanderbilt,exemption,Students can request accommodations for medical exemptions through the Student Access office an d religious exemptions through the Equal Opportunity and Access office.
125,0609_Vanderbilt,penalty of no compliance,A hold will be placed on a student’s course registration until the vaccination record has been verified unless they have an approved (or in-process request for) accommodation or they are an international student who will be vaccinated upon arrival in Nashville. A student’s enrollment at the university will be cancelled for the semester if the student is noncompliant.
126,0609_Vanderbilt,exemption,International students can request accommodations for medical exemptions through the Student Access office and religious exemptions through the Equal Opportunity and Access office .
127,0609_Vanderbilt,requirement-level,All full-time and part-time Vanderbilt University-employed faculty are required to be fully vaccinated against COVID-19 for the 2021–22 academic school year.
127,0609_Vanderbilt,requirement-who,All full-time and part-time Vanderbilt University-employed faculty are required to be fully vaccinated against COVID-19 for the 2021–22 academic school year.
128,0609_Vanderbilt,penalty of no compliance,"Faculty who have not submitted confirmation of vaccination and who do not have an approved or in-process request for exemption/accommodation by July 31 will be subject to appropriate Faculty Manual processes, including disciplinary actions."
129,0609_Vanderbilt,requirement-level,"All Vanderbilt University-employed staff—which includes full time, part time, flex and temporary—and all VU-employed postdocs are required to be fully vaccinated against COVID-19 for the 2021–22 academic school year."
129,0609_Vanderbilt,requirement-who,"All Vanderbilt University-employed staff—which includes full time, part time, flex and temporary—and all VU-employed postdocs are required to be fully vaccinated against COVID-19 for the 2021–22 academic school year."
130,0609_Vanderbilt,requirement-level,"This requirement applies regardless of whether staff are working on campus or remotely, now or in the future."
130,0609_Vanderbilt,requirement-who,"This requirement applies regardless of whether staff are working on campus or remotely, now or in the future."
131,0609_Vanderbilt,exemption,Staff and postdocs who decide to seek an exemption from the vaccination requirement as a medical or religious accommodation must submit a request for accommodation to the Equal Opportunity and Access office as soon as possible.
132,0609_Vanderbilt,penalty of no compliance,"Supervisors will be notified of those not in compliance, and the university will take appropriate disciplinary action, which will include termination of employment."
134,0610_UCLA,requirement-level,"The University of California Office of the President (UCOP) announced today that it is finalizing a policy that will require all UC faculty, staff, academic appointees and students to be vaccinated against COVID19, subject to narrow medical exemptions and accommodations based on disability or religious belief."
134,0610_UCLA,requirement-who,"The University of California Office of the President (UCOP) announced today that it is finalizing a policy that will require all UC faculty, staff, academic appointees and students to be vaccinated against COVID19, subject to narrow medical exemptions and accommodations based on disability or religious belief."
133,0610_UCLA,exemption,subject to narrow medical exemptions and accommodations based on disability or religious belief.
135,0610_UCLA,community,Vaccination is essential to protect the health and safety of the UCLA community and will facilitate our return to greater in-person campus operations .
135,0610_UCLA,safety,Vaccination is essential to protect the health and safety of the UCLA community and will facilitate our return to greater in-person campus operations .
135,0610_UCLA,benefit of vaccination,Vaccination is essential to protect the health and safety of the UCLA community and will facilitate our return to greater in-person campus operations .
135,0610_UCLA,health,Vaccination is essential to protect the health and safety of the UCLA community and will facilitate our return to greater in-person campus operations .
136,0610_UCLA,community,Thank you for doing your part to stop the spread of COVID19 and keep our community healthy.
136,0610_UCLA,responsibility of community members,Thank you for doing your part to stop the spread of COVID19 and keep our community healthy.
136,0610_UCLA,health,Thank you for doing your part to stop the spread of COVID19 and keep our community healthy.
137,0615_Arizona State,safety,"Arizona State University has worked closely with federal, state and local officials to align and work together with regard to public health and safety standards involving COVID-19 since the onset of the pandemic in January of 2020."
137,0615_Arizona State,health,"Arizona State University has worked closely with federal, state and local officials to align and work together with regard to public health and safety standards involving COVID-19 since the onset of the pandemic in January of 2020."
137,0615_Arizona State,regulations,"Arizona State University has worked closely with federal, state and local officials to align and work together with regard to public health and safety standards involving COVID-19 since the onset of the pandemic in January of 2020."
138,0615_Arizona State,expertise,"Along the way, we have rigorously followed the recommendations of the Centers for Disease Control and Prevention to manage and minimize the spread of the virus while simultaneously remaining open to our students and the public and conducting as many in-person classes as public health protocols allow."
138,0615_Arizona State,experience/educational needs,"Along the way, we have rigorously followed the recommendations of the Centers for Disease Control and Prevention to manage and minimize the spread of the virus while simultaneously remaining open to our students and the public and conducting as many in-person classes as public health protocols allow."
144,0615_Arizona State,leadership/public services,"We have also been a key partner to the state in inventing and providing mass testing and vaccine operations for the public, providing testing and management strategies to K-12 schools to get teachers and students back in the classroom, conducting scientific testing on the virus itself, and helping the state return to pre-pandemic operations."
141,0615_Arizona State,requirement-level,"Since the vaccine hit the market, we have communicated an expectation that students and employees get the vaccine, but it has never been a requirement."
141,0615_Arizona State,requirement-who,"Since the vaccine hit the market, we have communicated an expectation that students and employees get the vaccine, but it has never been a requirement."
139,0615_Arizona State,expertise,"As we bring all students and employees back together this fall for full in-person operations, we continued to follow the guidance of the CDC specific to universities and colleges and as it relates to having a campus that is a mix of fully vaccinated and unvaccinated individuals. The CDC recognizes the unique environments of Institutions of Higher Learning; the ASU student population includes people from all 50 states and more than 130 countries."
140,0615_Arizona State,requirement-level,"This week, we informed our student population of what to expect when they return to campus for the fall semester. We did not communicate a vaccine mandate. We reiterated our message that we expect students to get vaccinated given the health benefits, but also offered students a choice in the matter."
140,0615_Arizona State,requirement-who,"This week, we informed our student population of what to expect when they return to campus for the fall semester. We did not communicate a vaccine mandate. We reiterated our message that we expect students to get vaccinated given the health benefits, but also offered students a choice in the matter."
140,0615_Arizona State,benefit of vaccination,"This week, we informed our student population of what to expect when they return to campus for the fall semester. We did not communicate a vaccine mandate. We reiterated our message that we expect students to get vaccinated given the health benefits, but also offered students a choice in the matter."
142,0615_Arizona State,community,"And, we communicated a continuation of existing health protocols for students who are not yet vaccinated as they are at higher risk for infection and spreading the virus. Per the CDC: “IHE (Institutions of Higher Education) administrators should create programs and policies that facilitate the adoption and implementation of prevention strategies to slow the spread of COVID-19 at the IHE and in the local community. Evidence-based prevention strategies, including vaccination, should be implemented, and layered in IHE settings."
142,0615_Arizona State,expertise,"And, we communicated a continuation of existing health protocols for students who are not yet vaccinated as they are at higher risk for infection and spreading the virus. Per the CDC: “IHE (Institutions of Higher Education) administrators should create programs and policies that facilitate the adoption and implementation of prevention strategies to slow the spread of COVID-19 at the IHE and in the local community. Evidence-based prevention strategies, including vaccination, should be implemented, and layered in IHE settings."
